{"$defs":{"file":{"additionalProperties":false,"properties":{"path":{"pattern":"^(?!/)(?!.*(?:^|/)\\.{1,2}(?:/|$))[A-Za-z0-9][A-Za-z0-9._/-]*$","type":"string"},"raw_sha256":{"pattern":"^sha256:[0-9a-f]{64}$","type":"string"}},"required":["path","raw_sha256"],"type":"object"}},"$id":"https://autocut.invalid/contracts/2.1.3/stage_03/contributions/stage-03-owner-contribution.manifest.schema.json","$schema":"https://json-schema.org/draft/2020-12/schema","additionalProperties":false,"properties":{"b_input":{"const":{"handoff_git_commit":"50f78ea0b7f754eb8f91ef800924b86da25b3083","handoff_raw_sha256":"sha256:07fd0e9d4dbe03050f9aa3f4823755e4ba1e7f4852a163ab2fa291c0b3710eb6","producer_git_commit":"eb7e4181f63da308c405bad6d99fcd085cfdd98a","used_primitive_blobs":[{"path":"schemas/primitives/artifact-ref.schema.json","raw_sha256":"sha256:9df321d5ccc33dd8ff307aae6f33d1e4d2accfc278ea4fb5ed11072e5e5295db"},{"path":"schemas/primitives/domain-ref.schema.json","raw_sha256":"sha256:72211809fa19f967345ccc41574fea5319feb40bcbde05a3564cf6bc8c63f896"}]}},"closed_self_exclusion_protocol":{"const":{"exclusion_reason":"self_reference","external_attestation":"C3-A","external_attestation_bound_files":[{"path":"contributions/stage-03-owner-contribution.manifest.json"},{"path":"contributions/stage-03-owner-contribution.manifest.schema.json"}],"external_attestation_boundary":"independent","hash_binding_requirement":"later_independent_C3-A_attestation","producer_file_count_breakdown":{"external_attestation_bound_files":2,"hashed_source_files":10,"total_files":12}}},"contract_version":{"const":"2.1.3"},"deferred_bindings":{"const":["B0-012 remains unresolved.","B0-028/AC-B-008 remains unresolved.","AC-B-009 remains unresolved.","F/G ownership remains unresolved."]},"format":{"const":"autocut.stage-03-owner-contribution/v1"},"producer_base_commit":{"const":"50f78ea0b7f754eb8f91ef800924b86da25b3083"},"producer_file_count":{"const":12},"producer_files":{"items":false,"maxItems":10,"minItems":10,"prefixItems":[{"$ref":"#/$defs/file"},{"$ref":"#/$defs/file"},{"$ref":"#/$defs/file"},{"$ref":"#/$defs/file"},{"$ref":"#/$defs/file"},{"$ref":"#/$defs/file"},{"$ref":"#/$defs/file"},{"$ref":"#/$defs/file"},{"$ref":"#/$defs/file"},{"$ref":"#/$defs/file"}],"type":"array"},"producer_manifest_path":{"const":"contributions/stage-03-owner-contribution.manifest.json"},"repository_validation":{"$ref":"#/$defs/file"}},"required":["format","contract_version","producer_base_commit","b_input","producer_manifest_path","producer_file_count","producer_files","repository_validation","deferred_bindings","closed_self_exclusion_protocol"],"type":"object"}