{"b_input":{"handoff_git_commit":"50f78ea0b7f754eb8f91ef800924b86da25b3083","handoff_raw_sha256":"sha256:07fd0e9d4dbe03050f9aa3f4823755e4ba1e7f4852a163ab2fa291c0b3710eb6","producer_git_commit":"eb7e4181f63da308c405bad6d99fcd085cfdd98a","used_primitive_blobs":[{"path":"schemas/primitives/artifact-ref.schema.json","raw_sha256":"sha256:9df321d5ccc33dd8ff307aae6f33d1e4d2accfc278ea4fb5ed11072e5e5295db"},{"path":"schemas/primitives/domain-ref.schema.json","raw_sha256":"sha256:72211809fa19f967345ccc41574fea5319feb40bcbde05a3564cf6bc8c63f896"}]},"closed_self_exclusion_protocol":{"exclusion_reason":"self_reference","external_attestation":"C3-A","external_attestation_bound_files":[{"path":"contributions/stage-03-owner-contribution.manifest.json"},{"path":"contributions/stage-03-owner-contribution.manifest.schema.json"}],"external_attestation_boundary":"independent","hash_binding_requirement":"later_independent_C3-A_attestation","producer_file_count_breakdown":{"external_attestation_bound_files":2,"hashed_source_files":10,"total_files":12}},"contract_version":"2.1.3","deferred_bindings":["B0-012 remains unresolved.","B0-028/AC-B-008 remains unresolved.","AC-B-009 remains unresolved.","F/G ownership remains unresolved."],"format":"autocut.stage-03-owner-contribution/v1","producer_base_commit":"50f78ea0b7f754eb8f91ef800924b86da25b3083","producer_file_count":12,"producer_files":[{"path":"fixtures/structural/stage-03-owner-source-valid.json","raw_sha256":"sha256:5924f618c586bd73c7f04d16e461b21f85ced0b2d3538f75f1cc4e65f7397f76"},{"path":"obligations/blueprint-projection-worklist.json","raw_sha256":"sha256:3e8baea7b0be9138ff2c3c37cc78f90b24dae1c21599aeebca158ba97ff0020d"},{"path":"obligations/stage-03-rule-worklist.json","raw_sha256":"sha256:14f738a5ce8d7848768ca794d5b53c4c4cb87fc24004f6a2a11af653ac97c787"},{"path":"obligations/stage-03-vector-worklist.json","raw_sha256":"sha256:47ebdd3cff626b3611db36c49ea14156b21b0ebfeafade2b8a81f8be6dca4bed"},{"path":"shapes/context-manifest.shape.json","raw_sha256":"sha256:5ceda510166d38709b4bbb6cabf8f414eb3f2cb9067d0ce4f7dd1735e8d1f33e"},{"path":"shapes/editorial-blueprint.shape.json","raw_sha256":"sha256:6d4f77db406677681e7c9cdc54790d5c3483a2ae3532a35f6bc1acd35d4f49a5"},{"path":"shapes/evidence-closure-set.shape.json","raw_sha256":"sha256:bf582e5ea7d164c93bc880b600ddfdc8259e1f9059e356bdb46d100a4eccc854"},{"path":"shapes/generation-partition-plan.shape.json","raw_sha256":"sha256:666226ffc8f1e93a338365852f17de15956e708eb26e54fc083b4674f57651aa"},{"path":"shapes/merge-policy.shape.json","raw_sha256":"sha256:640ac77ff52cf56699cc8b342d460135460e0d06f6a6ebe6027ed225da64ab1d"},{"path":"tests/test-stage-03-structural-source.json","raw_sha256":"sha256:e5e676d4182eba6364b595d8f8c60b4896e1ace6dd6c70dbfb4d9cf5a3284be9"}],"producer_manifest_path":"contributions/stage-03-owner-contribution.manifest.json","repository_validation":{"path":"tests/contracts/test_stage03_owner_contribution.py","raw_sha256":"sha256:3e2ee2856104c25d4722a311f652290cb11dda428fc40e52b8bc3fd245e93639"}}